singers,lyric,id,title
Dee.A,"Bài hát: Trưởng Thành - Dee.A  Ver 1: Tháng năm vô tâm lăn trên nếp nhăn song thân Ta ngoảnh sang đã hai mấy, ôi thời gian trôi quá nhanh Dừng chút thôi, mỏi mệt quá rồi Tự ta nói “Truyện cổ tích có hay chăng”  Trái tim mong manh, luôn chất chứa bao cô đơn Mong được ai chạm tay tới, cho lòng ta thêm ấm hơn Còn ai nhớ chăng ngày hôm ấy ta sinh nhật Quà không có, không lời thăm hỏi  Trưởng thành lớn lên bao nhiêu, cô đơn bất an bao nhiêu Nhiều khi mà ta thèm giây phút ngây thơ khi xưa vọng về Lại đông rồi xuân làm ta muốn thét to khóc như vỡ òa Cứ lặng im giả vờ bước tiếp hiên ngang  Trưởng thành lớn lên bao nhiêu, cô đơn bất an bao nhiều Rằng con đường kia thật không dễ đi đâu ai sơn màu hồng Làm sao mà ta còn đây ánh mắt vô tư như thuở nào Mới hiểu ra đường phía trước không bình lặng  Ver 2: Trái tim tôi đau kỷ niệm hôm qua nay đâu Sao để lại một nỗi nhớ để giờ đây tôi phải quên Càng lớn lên thì càng thấy đau Càng trưởng thành hơn thì càng thấy nỗi cô đơn  Nước mắt rơi theo mưa nỗi buồn chôn dấu trong tim Phải làm sao để tôi thấy ánh cầu vồng bay trước mưa Dù rằng trái tim không thể cất giấu được ánh sao trời Phải làm sao để mình không lớn.  Trưởng thành lớn lên bao nhiêu, cô đơn bất an bao nhiêu Nhiều khi mà ta thèm giây phút ngây thơ khi xưa vọng về Lại đông rồi xuân làm ta muốn thét to khóc như vỡ òa Cứ lặng im giả vờ bước tiếp hiên ngang  Trưởng thành lớn lên bao nhiêu, cô đơn bất an bao nhiêu Rằng con đường kia thật không dễ đi đâu ai sơn màu hồng Làm sao mà ta còn đây ánh mắt vô tư không lo nghĩ Mới hiểu ra đường đời phía trước gian nan...  Tháng năm vô tâm, lăn trên nếp nhăn song thân Ta ngoảnh sang đã hai mấy, ôi thời gian trôi quá nhanh Dừng chút thôi, mỏi mệt quá rồi Biết ngày nao đôi tay làm nên ước mơ ",96763285-09d1-43b4-9afd-60aaf0685a5e,Trưởng Thành
Minh Châu,,6703129a-5a7a-4db0-8181-ec1e688176e9,Dạo Này Em Thế Nào Cover
Lưu Bá Vĩnh,"Bài hát: Cười Lên Nhé - Lưu Bá Vĩnh  Quà tặng cuộc sống chính là nụ cười Để đời đẹp tươi, hãy nỡ nụ cười Để gần nhau hơn, ta hãy mỉm cười Để quên âu lo, hãy nỡ nụ cười  Một nụ cười duyên say đắm bao người Một nụ cười tươi tương lai sáng ngời Một nụ cười Xinh cuốn bao ánh nhìn Nụ cười tỏa nắng xua tan buồn đau  Rap: Nụ cười trong tôi là cả thế giới Nụ cười mang tới cho ta những niềm tin Nụ cười xua tan đi màn đêm tăm tối Nụ cười dẫn lối cho ta những ngày bình yên Nụ cười hồn nhiên mang theo bao cảm xúc Nụ cười cầu chúc một sức khỏe dồi dào Nụ cười đón chào cho ta một ngày mới Bước tới hy vọng một tương lai sáng ngời Dù thất bại hay khó khăn vẫn luôn có nụ cười Vì nụ cười không thể mua không thể vay không thể mượn không thể ăn cắp  Quà tặng cuộc sống chính là nụ cười Để đời đẹp tươi, hãy nỡ nụ cười Để gần nhau hơn, ta hãy mỉm cười Để quên âu lo, hãy nỡ nụ cười  Một nụ cười duyên say đắm bao người Một nụ cười tươi tương lai sáng ngời Một nụ cười Xinh cuốn bao ánh nhìn Nụ cười tỏa nắng xua tan buồn đau ",e79a8332-59c7-415e-94b9-4bf71b8f5321,Cười Lên Nhé
"Lupi,Stonic,Sidie",,b5aeb477-78d3-4fe5-b5cf-980c322d95fb,Social Girls
ST Sơn Thạch,"Bài hát: Thật Xa Thật Gần - ST Sơn Thạch  Có bao giờ ngoài trời đang mưa mà em lại quên dù Có bao giờ việc nặng em mang mong chờ ai đó giúp em Có bao giờ một mình cô đơn, nỗi buồn tìm đến mỗi đêm em về Chỉ mong một người ở cạnh bên, nghe em thở than  Pre: Anh sẽ là Radio, phát những tiếng ca cho ngày em hết buồn chán Anh sẽ là may mắn, xoá hết khó khăn để nụ cười em tươi tắn Em có muốn một ngày mà trời đang mưa Một chàng trai đến ghé ô che đầu Để khi đêm về, em đã có ai để nói cười  Chorus: Cứ ngỡ thật xa nhưng rất gần (đừng lo nhé, vì anh ở kế bên em) Cứ ngỡ thật xa nhưng rất gần (đừng lo nhé, vì anh ở kế bên em) Cứ ngỡ thật xa nhưng rất gần (đừng lo nhé, vì anh ở kế bên em) Cứ ngỡ thật xa nhưng rất gần (đừng lo nhé, vì anh ở kế bên em)  Có bao giờ buồn phiền vây kín làm em chẳng thể cho mình Những con đường mình từng mong ước, tất cả rồi sẽ tốt thôi Có bao giờ một ngày anh đến, em lại tìm cách để cho duyên tình Khiến con tim mình một lần nữa mang bao thở than? ",c38fdb57-7548-46fe-9885-e58bf679bd29,Thật Xa Thật Gần
Dư Quốc Vương,Bài hát: Yêu Thương Nào Cho Tôi (Mối Tình Đầu Của Tôi OST) - Dư Quốc Vương  Này em Tâm hồn em tựa thủy tinh Trong lành như một sớm sương Vì sao em khóc buồn Vương trên tóc em Tôi thầm bao lần ước mong Trong lòng bao lần ngóng trông Vờ quên giây phút gần em thêm chút Có yêu thương nào cho tôi Hỡi em thôi mơ mộng Xin làm cơn gió bay thật xa đến nơi mà ta có nhau suốt đời Vòng tay ôm xiết không rời Cho dù kí ức Hay là những vết thương Mà em tự đem giấu sau đôi môi Nụ cười em sẽ mãi rạng ngời vì tôi   ,36eb8278-a686-47a2-9aa1-448a75977229,Yêu Thương Nào Cho Tôi (Mối Tình Đầu Của Tôi OST)
Nguyễn Kim Tuyên,"Bài hát: Bản Tình Ca Đơn Phương - Nguyễn Kim Tuyên  Đã bao lâu rồi Từ lúc ta chia tay rồi đấy Mà em vẫn hoài cô đơn vì lòng mãi còn Nhớ thương mỗi anh Để rồi chẳng tha thiết thêm ai Becuz I Chỉ có thể yêu mình anh mà thôi Chỉ có thể yêu mình anh đó thôi Từng ngày trôi càng thêm đau lắm những tháng ngày từng bên nhau Làm sao quên đi mắt môi mềm Từng đêm yêu đương nồng ấm Xin anh xin anh xin anh lắng nghe  Bản tình ca đơn phương Em luôn giữ cho mình anh Hỡi người yêu cũ của em Anh có hay Em vẫn luôn Mong chờ một ngày nắng kia sẽ mang anh quay về với em Có thể nào Liệu mình có thể nào?  Vì chỉ có thể yêu mình anh mà thôi Chỉ có thể yêu mình anh đó thôi Từng ngày trôi càng thêm đau lắm những tháng ngày mình bên nhau Làm sao quên đi mắt môi mềm Từng đêm yêu đương nồng ấm Xin anh xin anh xin anh lắng nghe  Bản tình ca đơn phương Em luôn giữ cho mình anh Hỡi ng yêu cũ của em Anh có hay Em vẫn luôn Mong chờ một ngày nắng kia sẽ mang anh quay về với em Có thể nào Người ơi có thể nào một lần nghe  Rằng em đây yêu anh Không nguôi nhớ nhung bên anh Hỡi người yêu cũ của em Anh có hay Em vẫn luôn Mong chờ một ngày nắng kia sẽ mang anh quay về với em. Có thể nào? Liệu mình có thể nào?  Em không tin anh đã hết yêu em rồi Bao mộng mơ khi xưa giờ đây vẫn làm trái tim em nhớ nhung Người yêu ơi, chỉ một lần nữa thôi! Xin anh, xin anh, xin anh, Lắng nghe.. Em luôn nhớ ",53b8f509-130b-4fe4-b2d7-e3521775b86b,Bản Tình Ca Đơn Phương
Lenatic Bubble Gum Hipsters,Chuyện Tình Trôi Mau - Lenatic Bubble Gum Hipsters  Giá như em biết yêu anh từ đầu Giá như ai hứa yêu ai đậm sâu Giá như hôm ấy em không đợi lâu Giá như anh nói em một câu Biết đâu em đã yêu anh đậm sâu Biết đâu anh hứa yêu em dài lâu Biết đâu hai đứa chung đôi cùng nhau Biết đâu ngày mai em sẽ không còn sầu Ngày trôi quá vội thôi em chẳng mong chúng mình thành đôi Người lỡ bước đi qua đời tôi Hẹn ngày mai nhé không gặp nhau Chuyện tình trôi mau ,c31a3f9a-b055-47d4-98f5-b3f2f427453b,Chuyện Tình Trôi Mau
Trí Thịnh,,02e87bce-ae52-411f-8089-d26518d04121,Anh Ơi Ở Lại Cover
Huy Vạc,,51d6c76e-c0cd-4a81-8d5e-52336cb740cf,Đừng Yêu Nữa Em Mệt Rồi Cover
Trần Tuấn Hiệp,"Bài hát: Liệu Giờ Em - Trần Tuấn Hiệp  Liệu giờ em đã quên, đã ***, ấm hơn giữa mùa đông ? Có hay, gió lay, vẫn đây, anh ngồi trông Còn vết lắng nơi anh đã mang, những úa tàn Nước mắt vơi nhanh thấm sang, từng cung đàn Dặn lòng quên đi em người ơi, nơi thành đô đông vui dấu kín lòng này Nhộn nhịp bon chen không nghỉ ngơi, hay đều mang tâm tư chất chứa còn đầy Dòng người cứ thế ai cũng ôm riêng những nốt trầm Tựa người dưới nắng nhưng đông vẫn mang buồn âm thầm  Pre-chorus Giờ em đã ngủ say chưa ? Giờ em có bình yên không ? Tàu vội qua, bước sai, lỡ chuyến tàu, Hẹn lần sau, thấy nhau, hẹn chuyến sau  Chorus Chỉ khi qua đi ta mới biết, nơi bình yên ta say giữa kỉ niệm Chìm vào sâu trong bao nuối tiếc, trút thở sâu khi buông tiếng li biệt Chút ít ta đem giấu đi, mãi giữ cho nhau để khi, Chẳng oán trách cứ như giấc mơ, đành bỏ lỡ những phím đàn bơ vơ Chỉ khi qua đi ta mới biết, nơi bình yên ta say giữa kỉ niệm Chìm vào sâu trong bao nuối tiếc, trút thở sâu khi buông tiếng li biệt Có nói ai đau đớn hơn người yêu nhiều Ngày mới đến ta đón sớm mai, nguyện xin giữ và trân yêu  Vers 2 Giờ thì em ở đâu Ôm mùa đông tĩnh lặng rồi thở sâu Giờ tan ca chẳng về nhà anh lang thang nơi góc phố đã từng như một thói *** ta chờ nhau Có phải là vô tình nếu vùi trôn đi kỉ niệm Bởi dù nếu cố gắng mình cũng chẳng thể đi tiếp, vậy Quá khứ đã dang dở cũng chẳng thể đâu hơn Dành yêu thương cho người mới, biết chân thành nhau hơn ! ",8c644388-b305-4c7b-99a3-a5a8f92ad629,Liệu Giờ Em
"Emily,BigDaddy","[Emily:] Khi mình xinh thì mình cứ thích khoe, cứ thích selfie đấy Mặc kệ cho ai nói ôi sao hôm nay lại thả thính thế Khi mình xinh thì mình cứ thích khoe, cứ thích đăng hình đấy Việc gì phải lo nghĩ đến ai quan tâm nhiều đến ai Em cần ai đó đi cùng em Dắt đi du lịch khắp chốn Nắm tay rồi ôm hôn và ghi lại khoảnh khắc em thật xinh Chứ thanh xuân vụt qua mất rất nhanh Hiểu không hả anh?  [Big Daddy:] Cô ta thường đăng những bức hình và luôn tỏ ra sang chảnh Cô ta thường viết những caption chẳng liên quan ảnh Cô ta săn tim mọi lúc dù bận rộn hay đang rảnh Ấy vậy mà facebook cô ta hàng ngày tôi vẫn ngồi canh Cô ta thường đăng những bức hình và luôn tỏ ra sang chảnh Cô ta thường viết những caption chẳng liên quan ảnh Cô ta săn tim mọi lúc dù bận rộn hay đang rảnh Ấy vậy mà facebook cô ta hàng ngày tôi vẫn ngồi canh  [Emily:] Khi mình xinh thì mình cứ thích khoe, cứ thích selfie đấy Mặc kệ cho ai nói ôi sao hôm nay lại thả thính thế Khi mình xinh thì mình cứ thích khoe, cứ thích đăng hình đấy Việc gì phải lo nghĩ đến ai quan tâm nhiều đến ai Em cần ai đó đi cùng em Dắt đi du lịch khắp chốn Nắm tay rồi ôm hôn và ghi lại khoảnh khắc em thật xinh Chứ thanh xuân vụt qua mất rất nhanh Hiểu không hả anh?  [Big Daddy:] Mật ngọt thì chết ruồi Khi em vừa đăng tấm ảnh các anh lại bâu vào hết rồi Chắc cũng đến cả tá thanh niên hi vọng được kết đôi Xôn xao phần bình luận, người khen kẻ thích và cả đãi môi Anh thì hơi kĩ tính nên cũng ít khi khen ai Nhưng mà em chỉ cần góp thính thì anh sẽ mua nem tai Hmm xem nào bức hình trông cũng được đấy Em mà thuộc về anh là muốn gì được nấy Cô ta thường đăng những bức hình và luôn tỏ ra sang chảnh Cô ta thường viết những caption chẳng liên quan ảnh Cô ta thường đăng những bức hình và luôn tỏ ra sang chảnh Cô ta thường viết những caption chẳng liên quan ảnh  [Emily:] Anh ơi anh không hiểu được đâu Sở thích của đám con gái anh không hiểu được đâu Chỉ việc yêu thương chính em đừng hờn trách em  [Big Daddy:] Ơ em chụp bằng máy gì đó  [Emily:] Anh ơi anh thôi đừng bận tâm Hình rất lung linh xinh xắn không đăng thì lại phí Chỉ việc quan tâm đến em và nhìn ngắm em ",8b25172f-0235-4893-9650-33e9965cad0f,Khi Mình Xinh Thì Mình Làm Gì Remix
Bảo Kun,Bài hát: Thà Đừng Nói Ra - Bảo Kun  Cũng đã khá lâu rồi kể từ khi đó Lúc anh nói ra lời mà bao ngày đắn đo Cứ nghĩ rằng sau nhiều lần ta đã nói cười Thì em cũng biết và hiểu cho lòng anh  Nhưng anh đã sai rồi phải không em hỡi Khi ta cứ như là chưa hề *** biết nhau Cũng chẳng còn những lời chào hỏi *** thuộc Ánh mắt thờ ơ chẳng giống như là mơ  Vậy thà đừng nói lên câu yêu em Để rồi thấy cô đơn thêm Thà để chúng ta xem nhau giống như những người bạn mỗi đêm Biết làm sao để mang hai ta trở về  Ngày mà đôi môi ấy tươi vui khi thấy anh Vậy thà để cho con tim ngu ngơ Hơn giờ mỗi anh bơ vơ Thà để những yêu thương cho em mình anh giữ nơi đây  Nếu tình yêu ấy vô tình làm em đau Thà đừng nói ra để rồi lạc mất nhau Anh quá vội vàng phải không em hỡi Khi em chưa hề quan tâm đến anh  Nhưng sao anh mà lại sợ sẽ mất đi chính em ngay cả khi Em không thuộc về anh Vậy thà đừng nói lên câu yêu em Để rồi thấy cô đơn thêm  Thà để chúng ta xem nhau giống như những người bạn mỗi đêm Biết làm sao để mang hai ta trở về Ngày mà đôi môi ấy tươi vui khi thấy anh Vậy thà để cho con tim ngu ngơ  Hơn giờ mỗi anh bơ vơ Thà để những yêu thương cho em mình anh giữ nơi đây Nếu tình yêu ấy vô tình làm em đau Thà đừng nói ra để rồi lạc mất nhau  Vậy thà đừng nói lên câu yêu em Để rồi thấy cô đơn thêm Thà để chúng ta xem nhau giống như những người bạn mỗi đêm Biết làm sao để mang hai ta trở về  Để được nhìn nụ cười người vui như lúc xưa Vậy thà để cho con tim ngu ngơ Hơn giờ mỗi anh bơ vơ  Thà để những yêu thương cho em mình anh giữ nơi đây Nếu tình yêu ấy vô tình làm em đau Thà đừng nói ra để rồi lạc mất nhau. ,a103285b-4f10-4696-9d30-20a4951a98a9,Thà Đừng Nói Ra
Bảo Kun,Bài hát: Thà Đừng Nói Ra - Bảo Kun  Cũng đã khá lâu rồi kể từ khi đó Lúc anh nói ra lời mà bao ngày đắn đo Cứ nghĩ rằng sau nhiều lần ta đã nói cười Thì em cũng biết và hiểu cho lòng anh Nhưng anh đã sai rồi phải không em hỡi Khi ta cứ như là chưa hề *** biết nhau Cũng chẳng còn những lời chào hỏii *** thuộc Ánh mắt thờ ơ chẳng giống như là mơ  Vậy thà đừng nói lên câu yêu em Để rồi thấy cô đơn thêm Thà để chúng ta xem nhau giống như những người bạn mỗi đêm Biết làm sao để mang hai ta trở về Ngày mà đôi môi ấy tươi vui khi thấy anh Vậy thà để cho con tim ngu ngơ Hơn giờ mỗi anh bơ vơ Thà để những yêu thương cho em mình anh giữ nơi đây Nếu tình yêu ấy vô tình làm em đau Thà đừng nói ra để rồi lạc mất nhau  Anh quá vội vàng phải không em hỡi  2  Khi em chưa hề quan tâm đến anh Nhưng sao anh mà lại sợ sẽ mất đi chính em ngay cả khi EM KHÔNG THUỘC VỀ ANH...  Vậy thà đừng nói lên câu yêu em Để rồi thấy cô đơn thêm Thà để chúng ta xem nhau giống như những người bạn mỗi đêm Biết làm sao để mang hai ta trở về Ngày mà đôi môi ấy tươi vui khi thấy anh Vậy thà để cho con tim ngu ngơ Hơn giờ mỗi anh bơ vơ Thà để những yêu thương cho em mình anh giữ nơi đây Nếu tình yêu ấy vô tình làm em đau Thà đừng nói ra để rồi lạc mất nhau Vậy thà đừng nói lên câu yêu em Để rồi thấy cô đơn thêm Thà để chúng ta xem nhau giống như những người bạn mỗi đêm Biết làm sao để mang hai ta trở về Để được nhìn nụ cười người vui như lúc xưa Vậy thà để cho con tim ngu ngơ Hơn giờ mỗi anh bơ vơ Thà để những yêu thương cho em mình anh giữ nơi đây Nếu tình yêu ấy vô tình làm em đau Thà đừng nói ra để rồi lạc mất nhau ,0776a111-5f2a-4624-8037-fca976dfc88f,Thà Đừng Nói Ra
Bảo Trâm,"Bài hát: Gửi Dịu Dàng, Gửi Thanh Xuân - Bảo Trâm  Em ngồi đây và nghe tôi hát Dù nắng tắt nhưng tôi nhìn thấy em Dù có gió lao xao đùa tóc em Tôi chỉ muốn ôm em vào lòng  Em dừng chân, tôi có điều muốn nói Khẽ rất khẽ tôi đã chờ rất lâu Có chút nắng che nghiêng nhòa mắt nhau Tôi chỉ nghe tiếng mưa trong lòng  Rồi nắng, hạt nắng buông hạt nắng buông nhẹ Đời cứ trôi, lặng lẽ trôi nhẹ Bao ngày qua tôi vẫn đang chờ  Chờ đợi em, chờ đến khi ngày cuối xuân về Khoảnh khắc hoa đào cũng rơi lệ Để em biết tình đậm say  Em là tôi khi mười tám Như cây tầm xuân hé nụ Em là dịu dàng của tôi Em là nồng nàn tình tôi  Ta gặp nhau khi vừa chớm Đông vừa qua xuân về sớm Cho tôi ôm ấp chờ đợi Cho tôi nhung nhớ không nguôi Em hãy về với tôi  ",e217fa83-a758-4974-ad11-c55ead4585f6,"Gửi Dịu Dàng, Gửi Thanh Xuân"
Jack (G5R),"Ai gieo tình này, ai mang tình này, để lệ trên khóe mi cay Ai đưa về nhà, ai cho ngọc ngà, giờ người xa cách ta Từng là một thời thiếu nữ trong vùng quê nghèo  Hồn nhiên cài hoa mái đầu Dòng người vội vàng em hóa thân đời bẽ bàng Rời xa tình anh năm tháng  [Đk:] Ôi phút giây tương phùng anh nhớ và mong Dòng lưu bút năm xưa in dấu mãi đậm sâu Trong nỗi đau anh mệt nhoài Trong phút giây anh tìm hoài  Muốn giữ em ở lại một lần này vì anh mãi thương Xa cách nhau thật rồi sương trắng chiều thu Ngày em bước ra đi nước mắt ấy biệt li Hoa vẫn rơi bên thềm nhà  Lá xát xơ đi nhiều và Anh chúc em yên bình mối tình mình hẹn em kiếp sau Thoáng thoáng, ngày miêng mang, giờ con nước dài thênh thang Không trách, người không thương, mà hương tóc còn vương vương  [Rap:] Gửi tặng em màu son cỏ dại Chút bình yên trên môi bỏ lại Nước mắt nào thấm đẩm cả hai vai Mắt phượng mày ngài người phải tìm đến thiên thai  À ơi câu hát em không cần những lời khuyên Em buông thả mình và chẳng màng đến tình duyên Đời em phiêu bạc đau đớn lắm lúc cũng vì tiền Thương thân em khổ để một lần cùng chí tuyến  Giờ em ở nơi khuê phòng Ngày mai nữa em theo chồng Và tô má em thêm hồng ôi đớn đau lòng ôi đớn đau lòng Bình minh dẫn em đi rồi  Vòng xoay bánh xe luân hồi Hoàng hôn khuất sau lưng đồi ôi vỡ tan rồi ôi vỡ tan rồi! Một ngày buồn mây tím, em về thôn làng  Mẹ cha của em vỡ òa Giọt lệ chạnh lòng em khóc, thương người sang đò Hồng nhan bạc phận – sóng gió!  [Đk:] Ôi phút giây tương phùng anh nhớ và mong Dòng lưu bút năm xưa in dấu mãi đậm sâu Trong nỗi đau anh mệt nhoài Trong phút giây anh tìm hoài  Muốn giữ em ở lại một lần này vì anh mãi thương Xa cách nhau thật rồi sương trắng chiều thu Ngày em bước ra đi nước mắt ấy biệt li  Hoa vẫn rơi bên thềm nhà Lá xát xơ đi nhiều và Anh chúc em yên bình mối tình mình hẹn em kiếp sau ",a790b87c-56db-4009-b6ce-ae1be314d3af,Bạc Phận (Piano Version)
Nguyễn Hương Ly,,67bc4a68-544e-4336-b98b-ac6d8bb371bd,Anh Ơi Ở Lại Cover
Jay Quân,Cười lên em nhé hãy cố mạnh mẽ dẫu biết rằng sẽ chia cách muôn đời Tình yêu phơi phới nay xa tầm với trách ai buông lơi không lời biệt ly Tuổi thanh xuân theo con sóng cứ trôi đi không khi nào ở lại Sợ ngày mai thời gian sẽ khâu lại những vết thương.  Người anh yêu hỡi anh luôn ở đây em sẽ nhìn thấy ở phía chân mây Đừng lo em nhé anh vẫn lặng lẽ chở che cho em Một mai khi ánh nắng mới sưởi ấm con tim đừng ngại ngùng em hãy kiếm tìm Tìm một người tốt hơn cho em niềm vui.  Đừng chờ anh nữa chẳng ai đón đưa Đừng mong anh đã về chưa dưới cơn mưa Đừng ngu ngốc tự lừa dối rằng anh sẽ quay về nữa Rồi mai thức giấc chỉ còn mỗi em Hãy thật mạnh mẽ để em bước tiếp đoạn đường Đoạn đường hai ta đã vẽ ra nay không còn anh.  Xin em đừng khóc xin em đừng khóc Vì anh chỉ muốn thấy em cười Dù chỉ một lần sau cuối em hỡi.  ,316d5c01-4d17-47c7-bce9-3a6d99ef1727,Thanh Xuân Không Trở Lại
Thùy Chi,"Bài hát: Gần Ngay Trước Mắt - Thùy Chi  Chiều đầy gió, đường quanh co Em đi tìm giấc mơ đời mình Lang thang tìm kiếm anh một mình  Mà đâu biết người ngay đây Sao em còn mải mê lạc đường Ngây ngô chẳng nhận ra yêu thương  Gần ngay trước mắt mà tìm hoài đâu thấy Gần ngay trước mắt người quẩn quanh nơi đây Mải mê tìm, mải mê chờ Chẳng thể ngờ người đã đứng đó Miệt mài ngày đêm thương nhớ Mà em có biết Tự giận mình ngây thơ Tình yêu ngay đây mà tìm xa tít tận chân trời  Hoàng hôn vắng, người ngược nắng Đôi chân chẳng biết đâu là bờ Cô đơn lòng chẳng nguôi từng giờ Tìm đâu thấy người em say Mây bay rồi sẽ tan về trời Sao em còn một mình chơi vơi  Gần ngay trước mắt mà tìm hoài đâu thấy Gần ngay trước mắt người quẩn quanh nơi đây Mải mê tìm, mải mê chờ Chẳng thể ngờ người đã đứng đó Miệt mài ngày đêm thương nhớ Mà em có biết Tự giận mình ngây thơ Tình yêu ngay đây mà tìm xa tít tận chân trời...     ",430aec1d-59b6-4b2b-bf9d-06a396975ffd,Gần Ngay Trước Mắt
black.,"Bài hát: Quay Đi - black.  Verse 1: Đọng lại một chút bình yên còn vương Trên bờ môi của anh Mong sao cho trái tim này Quên được em  Get out of my way Get out of my way Buông đôi tay nhau đi Chẳng cần tiếc chi  Pre-Chorus: Từng ngày bước trên con đường dài Lòng anh nhói lên bao sợ hãi Nhận ra chúng ta không thể quay về bên nhau Sâu trong con tim anh vẫn luôn nhớ em  Chorus: Và anh đã biết ngày Đông này ta mất nhau thật rồi Quên đi hết những phút giây mình chung đôi No more chance to get back, i’ll give up on you Dẫu quay về sẽ chỉ còn mỗi em mà thôi  Pre-Chorus 2: Thời gian đã mang bao tổn thương Trong anh cuốn theo những vội vã Nhận ra chúng ta không thể quay về bên nhau Sâu trong con tim anh, mong em hạnh phúc  Chorus: Và anh đã biết ngày Đông này ta mất nhau thật rồi Quên đi hết những phút giây mình chung đôi No more chance to get back, i’ll give up on you Dẫu quay về sẽ chỉ còn mỗi em mà thôi  Bridge: Bỏ mặc anh Hãy bình yên Bây giờ ta Never, never, never get back  Chorus: Và anh đã biết ngày Đông này ta mất nhau thật rồi Quên đi hết những phút giây mình chung đôi No more chance to get back, i’ll give up on you Dẫu quay về sẽ chỉ còn mỗi em mà thôi ",d680cdcc-a907-406a-b8d9-ec8157f53fe5,Quay Đi
