singers,lyric,id,title
T-PAME,Bài hát: Phải Không Em Beat - T-PAME  Buồn này ai thấu anh cầu mong Ta sẽ không rời xa Cứ yêu trọn đời cho nhau cả bầu trời Gió sẽ mang tới niềm vui  Nào ngờ gió tắt cơn mưa về đây Anh và em chia tay Khóc thêm càng nhiều Xót xa càng hơn Hai chúng ta mỗi người một ngã  [Đk:] Tình yêu khi xưa mình trao bao mơ mộng Giờ ngồi đây cô đơn lạnh giá như mùa đông Kí ức xưa ùa về lòng anh não nề Hỡi người ơi  Ngày xưa em nói không xa rời Em nói yêu trọn đời Mà giờ đây anh phải lẻ loi vậy sao Em ơi anh biết được tình yêu khi tồn tại Yêu thương nào mà chẳng có nhói đau Phải không em  [Bridge:] Tình yêu đôi ta chỉ là nỗi đau Bên nhau chẳng bao lâu Rồi xa nhau em về nơi ấy Tình yêu đôi ta muôn ngàn xót xa Chẳng thể quay đầu lại mà thứ tha Rồi giờ đây mỗi người 1 ngã ,dd95a2be-6b61-44e9-bd0e-73e923a2c8db,Phải Không Em Beat
"Thanh Hoa (NSND),Hà Anh,Minh Phượng",,addd9c9c-6db2-4848-8e7f-0634a10b4b36,Như Hoa Mùa Xuân Cover
Phạm Tùng Linh,"Từ bao giờ, thấy thẫn thờ Cũng từ bao giờ vẫn vờ đếm ánh sao mờ Kia là yêu là không là yêu là không mờ hồ Và đây là yêu là không là yêu là những mộng mơ  Từng ngày qua cứ thế Và từng đêm cũng thế như trong cơn ngủ mê Lặng thầm theo hết những đam mê dại khờ Của một ai đó ngỡ vu vơ  Một mình ôm nỗi nhớ Một mình ôm khao khát mong manh mơ hồ Một mình với những nỗi ngẩn ngơ Đợi chờ và mộng mơ.  [Điệp khúc:] Mơ ngày mai ánh mắt em nhìn, nhìn về phía tôi Mơ ngày mai lối em đi về là đường tôi Xin thời gian hãy cho ngừng lại dù trong phút giây Một lần từ trái tim này  Được nói với em rằng tôi Yêu thầm mơ thầm yêu là như thế Vui buồn hay hờn ghen thật vô cớ Yêu chỉ riêng mình yêu Yêu trong mơ.  [Rap:] Và tôi có một câu chuyện nhỏ muốn kể cho em Câu chuyện về thời mộng mơ Về những phút giây thẫn thờ Về những cảm xúc bâng quơ Về những người điên vô cớ Về con tim của một chàng trai khi lần đầu loạn nhịp Mà chẳng kịp định hình xem ai gõ cửa trái tim mình Là rồi để ngấm một lần điên Là cô đơn khi đêm phải xao xuyến Nỗi nhớ mà không được đặt tên Là những lần ngập ngừng khi bước qua em Chỉ con tim đánh rơi đôi lời muốn nói Chỉ cần mong thời gian ngừng lại giờ trong giây phút này thôi Tôi muốn nói với em đôi lời thầm giấu trong con tim bấy lâu rằng tôi ",b29eca94-fe22-43ec-ab14-6b166c21c8cf,Nói Với Em Rằng Cover
Freshlyrc,Bài hát: Yêu Em Đến Mai - Freshlyrc  Anh sao mà không thể quên em? Yêu thương kia đi qua Bâng khuâng vương thoáng môi mềm Góc phố cũ lỡ nhuốm một màu buồn  Trời dần buông mây đen cho mưa kia cứ tuôn Như ngày đầu tiên ta lỡ Có chút gì ta dành cho nhau? Hay cho nhau thương đau  Ai riêng ai cứ u sầu Nào mình có biết đâu ohh Trong con tim cũng biết đau uh huhhhh Anh không muốn nghĩ để rồi càng buồn  Nên thôi nhé để nhạt mờ dần theo thời gian sẽ chóng phai phôi Chỉ yêu em đến mai thôi yeah Nên dù tha thiết anh sẽ dừng lại  Đong đầy nỗi nhớ dài mệt nhoài Chuyện tình yêu tan vỡ trái tai Chẳng một ai tha thiết đúng sai no YÊU EM ĐẾN MAI THÔI  YÊU EM ĐẾN MAI THÔI no no YÊU EM ĐẾN MAI THÔI YÊU EM ĐẾN MAI THÔI x 2 Yêu em đến mai thôi  Khi hai ta không thành đôi Dù sao chỉ anh mới buồn ahhh Lỡ yêu em đậm sâu Mà chẳng nói yêu em một câu  Giấu trong tim bao lâu để rồi nay dường như vỡ òa ehh Can you feel my love? Can you feel in your heart  Dù anh có yêu em bao nhiêu Cũng chẳng khiến tim em liêu xiêu Do you know mah babe? ,be9fe2f2-4b82-41b3-a4ea-693fcd969d1f,Yêu Em Đến Mai
Đoan Trang,,5874877c-05dc-42d2-9c48-20cbe7e7dc14,Thoát Ly
Kim Hải Ha-Ki,,f38fe2ef-939d-4f98-9992-78ad3dac3ac5,Học Tiếng Mèo Kêu Cover
Đăng Minh,,c5cbe2f2-a169-4c46-ad50-395a717eb0c5,Em Muốn Anh Đưa Anh Về Cover
NVM,,70b7f240-e489-4881-bad9-573da7c14c6a,Cách Anh Từng Làm (Love Or Lust)
Võ Hạ Trâm,,8f9100cb-be2a-4e00-bef6-431bc58a18f7,Giấc Mơ Tuyệt Vời
Tuấn Phong,,c0d34a05-f19b-41ac-8ce9-7bab2bb20ee9,Hạnh Phúc Cuối Cùng
Nguyễn Hồng Ân,"Bài hát: Yêu Em - Nguyễn Hồng Ân  Yêu em vì ta ghét buồn Yêu em vì ta ghét hờn Yêu em vì ta khinh khi dối gian Yêu em vì ta chán người Yêu em vì ta chán đời Yêu em vì ta không tin ở trời Ta không thèm mái tóc huyền Ta không thèm đôi mắt đẹp Ta không màng lời khen chê thế gian Ta không cần ai hiểu mình Khi ta ngợi ca ái tình Khi ta dìu em đi trong ý thơ Em ơi, anh muốn nói rằng Sao em còn mãi hững hờ Khi anh trọn lòng yêu em thiết tha Xin em đừng luôn dối lòng Khi tim làm đôi má hồng Cho ta được gần nhau trong giấc mộng...  ",2b6214d5-066b-4c18-9578-44188dbbe983,Yêu Em
Sơn Ca,,880c6c51-0221-4882-937f-c75dea50070b,"LK Hãy Quên Nhau, Hoang Vắng, Em Là Tất Cả, Chờ Đông"
Đức Thành,"Nơi Con Tim Rực Cháy - Đức Thành  Cuộc đời này còn bao sóng gió Xung quanh nơi đây ta vẫn thấy bao nhiêu phiền lo Lặng nhìn dòng đời như gió cuốn Dù khó khăn gian nan muôn vàn.  Mọi lo âu hôm nay, rồi sẽ tan đi ngay Khi bao đam mê vẫn rực cháy trong lòng Đừng ngại chi em ơi, hãy vững bước đi nào Vì cuộc đời này còn những ước mơ.  Một ngày mới, nắng lên Ấm áp nơi con tim bình yên Hãy cùng nhau nắm tay Bước đến những chân trời xa  Có những lúc trong cuộc đời Chỉ cần mỉm cười đẩy lùi quá khứ đau thương mà thôi Và hãy sống vui từng ngày Nơi con tim yêu luôn rực cháy.  Mọi lo âu hôm nay, rồi sẽ tan đi ngay Khi bao đam mê vẫn rực cháy trong lòng Đừng ngại chi em ơi, hãy vững bước đi nào Vì cuộc đời này còn những ước mơ.  Một ngày mới, nắng lên rồi Ấm áp nơi con tim bình yên mãi thôi Hãy cùng nhau nắm tay Bước đến những chân trời xa... ",38f6a143-c4cf-4bc1-8cef-72e9fb783e77,Nơi Con Tim Rực Cháy (Dance Version)
Vũ Khởi Nguyên,"Đêm dài thêm từ khi chúng ta Nhìn nhau mà chẳng thể nói một lời cho nhau thấy vui Em cứ giữ mãi nỗi hoang mang riêng mình em trong tim Anh buông câu thở than trong từng nỗi vui  (Sao em không khóc lên để vụt tan đi Sao anh không thể ôm em để xóa hết Không gian kia thẫn thờ như người điên Ta ngây ngô trách nhau vội vàng  Sao đêm cứ mãi từ chối ngày mai Dày vò lòng người mãi khi không một ai Anh chìm trong màn đêm hiu quạnh Chợt nghe thấy âm thanh từ ai  Giật mình tỉnh giấc đôi tay lạnh buốt đắng cay Đông dài, trôi hoài, mong quay về những tháng ngày Còn yêu nồng nàn lúc bên nhau) (Rồi lại nhận ra những câu ca *** thuộc mà  Chẳng thể nào tìm thấy bóng em từ những thói *** Đêm dài mình anh đi tìm mãi) Mình anh vẫn lang thang đường đêm Phía chân trời bình minh rực sáng  Sao chẳng mang tình yêu của anh đến em Từng ngày trôi qua em ở đâu Tìm buồn phiền âu lo sao em có giấu Quay về đây cùng anh để cho đường đêm anh có em ",3d01b6b1-ad75-45bb-99d1-083d7625c848,Đường Đêm
Dee.A,"Bài hát: Trưởng Thành - Dee.A  Ver 1: Tháng năm vô tâm lăn trên nếp nhăn song thân Ta ngoảnh sang đã hai mấy, ôi thời gian trôi quá nhanh Dừng chút thôi, mỏi mệt quá rồi Tự ta nói “Truyện cổ tích có hay chăng”  Trái tim mong manh, luôn chất chứa bao cô đơn Mong được ai chạm tay tới, cho lòng ta thêm ấm hơn Còn ai nhớ chăng ngày hôm ấy ta sinh nhật Quà không có, không lời thăm hỏi  Trưởng thành lớn lên bao nhiêu, cô đơn bất an bao nhiêu Nhiều khi mà ta thèm giây phút ngây thơ khi xưa vọng về Lại đông rồi xuân làm ta muốn thét to khóc như vỡ òa Cứ lặng im giả vờ bước tiếp hiên ngang  Trưởng thành lớn lên bao nhiêu, cô đơn bất an bao nhiều Rằng con đường kia thật không dễ đi đâu ai sơn màu hồng Làm sao mà ta còn đây ánh mắt vô tư như thuở nào Mới hiểu ra đường phía trước không bình lặng  Ver 2: Trái tim tôi đau kỷ niệm hôm qua nay đâu Sao để lại một nỗi nhớ để giờ đây tôi phải quên Càng lớn lên thì càng thấy đau Càng trưởng thành hơn thì càng thấy nỗi cô đơn  Nước mắt rơi theo mưa nỗi buồn chôn dấu trong tim Phải làm sao để tôi thấy ánh cầu vồng bay trước mưa Dù rằng trái tim không thể cất giấu được ánh sao trời Phải làm sao để mình không lớn.  Trưởng thành lớn lên bao nhiêu, cô đơn bất an bao nhiêu Nhiều khi mà ta thèm giây phút ngây thơ khi xưa vọng về Lại đông rồi xuân làm ta muốn thét to khóc như vỡ òa Cứ lặng im giả vờ bước tiếp hiên ngang  Trưởng thành lớn lên bao nhiêu, cô đơn bất an bao nhiêu Rằng con đường kia thật không dễ đi đâu ai sơn màu hồng Làm sao mà ta còn đây ánh mắt vô tư không lo nghĩ Mới hiểu ra đường đời phía trước gian nan...  Tháng năm vô tâm, lăn trên nếp nhăn song thân Ta ngoảnh sang đã hai mấy, ôi thời gian trôi quá nhanh Dừng chút thôi, mỏi mệt quá rồi Biết ngày nao đôi tay làm nên ước mơ ",b1cd1127-67b4-40f0-a1a9-094bfbb8eb33,Trưởng Thành (Ballad Version)
"Đạt G,Hoàng Mỹ Duyên,Hồng Phương",,315878ef-1e25-489e-93e8-c531628ccc34,Long Phụng Sum Vầy
Soobin Hoàng Sơn,,06da3812-4a9b-4694-86c1-7134074835ac,I Know You Know (Acoustic Version - Live)
"Lee Wolves,Lion Leo",,2e8aedc6-9e0a-4339-a8fb-4e2b8f710382,Cảm Ơn Em
Quỳnh Như,,95f35829-12e8-4941-a24a-887b3cb8716e,Happy New Year (Vietnamese Cover)
Vĩnh Túc,"Bài hát: LK Cánh Bướm Vườn Xuân, Thì Thầm Mùa Xuân - Vĩnh Túc  Vườn xuân thơm ngát hương xuân sắc hoa hàm tiếu Hoà đưa khát khao duyên nồng tình yêu Vườn xuân thơm ngát hương xuân sắc hoa hàm tiếu cánh hoa mỹ miều  Một hôm cánh bướm tung tăng đến dâng tình yêu chợt đưa kiếp hoa u sầu quạnh hiu Một hôm cánh bướm tung tăng đến dâng tình yêu dáng hoa yêu kiều  Cánh bướm ríu rít vui bên hoa Hương hoa bay nhanh đưa xa xa Sắc thắm cánh bướm không phôi pha Hoa thêm xinh tươi vương câu ca Không gian như lắng trong bao la Lúc cánh bướm nắng trong hương hoa Tiếng hát thánh thót như ngân nga gió xuân la đà  Vườn xuân ong bướm ngất ngây ngất ngây tình hoa Như đang đắm say ru hồn lòng ta Vườn xuân ong bướm ngất ngây ngất ngây tình hoa Tiết xuân chan hòa  ... Tình xuân dâng ngát hoa Từng chồi non xanh mơn man Từng hạt mưa long lanh rơi mùa xuân Và trong ánh mắt lấp lánh Lời yêu thương yêu thương ai ngập ngừng Mùa xuân đã đến bên em Và mùa xuân đã đến bên anh thì thầm Làn gió khẽ vuốt tóc em Và làn gió nói cùng em nhớ thương  Và em đã biết nói tiếng yêu đầu tiên Và em đã biết thương nhớ biết giận hờn Mùa xuân đã đến bên em trao nụ hôn Và mùa xuân đã trao cho em ánh mắt anh  Để rồi, đắm say Để rồi ngất ngây ",0a9bbe29-f5b8-4561-9c57-2be7158a9125,LK Thì Thầm Mùa Xuân
Black Band,,ee0a21b8-503a-4c03-9ef7-002f0ff34e93,"Mashup Xuân Không Màu, Tết Là Gia Đình"
V.A,,2d5a7f61-2612-44f5-ba7a-c783dace0c92,Phút Giao Thừa Lặng Lẽ Cover
Duy Minh,,3c7709df-77de-4168-96b6-3333d7610cee,Con Tim Hoang Lạnh Cover
Tạ Minh Tâm,,8176f8f1-2f7f-4026-ae8b-f27c90e845e9,Nồng Nàn Ninh Thuận Quê Tôi
Nguyễn Trần Trung Quân,,bbffc69f-a208-449a-978a-990d6e5c01d2,Anh Ơi Ở Lại Cover
Nguyễn Hoàng Vân,,5706bf04-78a7-4cd0-aeb6-81889a064ce5,Tết Nguyên Đán
V.A,,108e6902-6fb1-4031-bf0a-7a4e4f2565e4,Hát Với Chú Ve Con
V.A,,32ba2883-223a-4ee6-93d1-6413a83fd516,Trống Cơm
"Blacka,Zephyr","Blacka: Intro It's BLACKA baby Anh yêu em, lúc nào anh cũng yêu em (hết trơn á) Wassup baby! U know I miss u right?! I miss u so damn! Ver1: Yo! Nhớ không lầm là 2008 Lúc đó em cũng đã đẹp đi học trong trường có nhiều kẻ bám Lúc đó thì anh còn nhỏ và nghĩ mặt trời chỉ vừa nắm tay Cho đến lúc anh nghe em nói thì anh đã biết là mình đắm say baby Em dạy cho a thật nhiều điều Dạy cho a trở nên cứng cõi nói thiệt cấp 1 a liều xiều Dạy cho a đối nhân xử thế, sống làm sao cho tử tế Ta đã hòa vào nhau là 1 vào một buổi chiều bằng nhiều tư thế baby Chưa bao giờ e đối xử tệ Khi e lên đồ ra phố chỉ có thể nói một chữ nghệ E thuần khiết như giọt sương sớm, mọi thứ e làm chỉ để vui E chẳng cần phụ kiện tốn kém nói thẳng là e rất dễ nuôi cưng A yêu e cũng chỉ vì vậy A nghiện vẻ đẹp chân phương, có phần thân thương, hơi bị quậy E có lúc cà nhây, lúc nhiệt tình, tùy thời điểm thích hợp Khỏi thắc mắc a vẫn vậy mãi yêu em hiphop   Dép: Hook Đời người khó đoán, còn lắm lo toan Mờ dần những phút giây em còn đây ngất ngay Đừng buồn em hỡi, mình sẽ rong chơi Tìm lại những giấc mơ đến giờ chưa phai màu (mờ)   Ver2: Cuối 2012 e bắt đầu nổi Có mặt trên nhiều phương tiện, gương mặt đại diện để cầu nối E lai vãn tới nhiều bar sàn e có bạn thân là gái gọi E nói e tôn trọng respect không coi việc đó là cái tội E vẫn giữ lại được cái tôi, là thứ người ta khoái coi Con beat e xài là đồ ăn cắp còn tag là phải rồi E đổ thừa chính quyền nhà nước không tạo điều kiện để phát triển Chả ai trả nhiều hơn 5 xị để coi một con đồng nát diễn Em cũng nhận thức điều này, e đủ thông minh để hiểu sau khi leo núi và thức nhiều ngày Trong cơn ảo giác những nổi đau lại tái hiện Nhưng e nhận ra trước giờ mình sống được là nhờ vào cái miệng E không chống số phận, số phận cũng chống lại e Sẽ ra sao nếu VietDragon hồi sinh và sống lại em? Karik và Wowy ở khu tao sống lại xem Và DeadNah vẫn một mình mà chấp một đống tại EM E đâu còn như những ngày xưa cũ Dây chuyền vàng đồ hiệu với e là chưa đủ Tệ nạn, băng đảng, chân ở cửa tù E sân si, e sanh nạnh, e nuôi lớn ngọn lửa thù E đâu còn thèm nhớ tới a đâu Nhớ một thời chỉ em và anh trong phòng để canh flow Mic track 1 2 không có nhịp sót A vẫn vậy luôn và sẽ yêu em nhiều hiphop   Dép: Hook repeat   Ver3: Bây giờ là 2018 (2019) Theo đuổi em còn nhiêu người ***??? Anh chỉ là một trong số những kẻ điênnnn Những kẻ điên với những lý lẽ riêngg Thời gian trôi, vài lời ngang môi, nhìn trời than ôi! Em đã dần *** với những lời đường mật Không còn truỵ lạc vào mỗi cuối tuần mà đã thành thường nhật... Em sống vội... Ngáo chết mẹ! Mà cứ nghĩ là mình khó lường thật Em chẳng còn thú vị, em làm trò như mấy *** đang lần mò sự chú ý Lấy lý do tuổi thơ khó nhọc nên bản tính khó nhu mì Nhưng đời thì lại bạc như vôi em à, mọi sự đều có chu kỳ! Nay nổi mai chìm, từng là tất cả nhưng cũng có lúc cô quạnh mà chả ai tìm Em lê la phòng trà quán xá, những nơi coi mình đáng giá Em mua vui cho nhà tài trợ, nó coi em là phương tiện quảng bá Em phải đóng giả nhiều vai, em không phân biệt giữa việt rap đỉnh và facebook có nhiều like Ghi nhớ lời anh hay khuyên: Ai cũng có cái hay riêng! Còn ngai vàng theo thời gian từng người một sẽ thay phiên! Anh biết mình không phải là tình đầu 313, SSR, GODZ, G-Fam, SOUTHGANGZ, GnD, SouthPride S-Hood, Ringing Band, NKI SouthSide Có những tên tuổi lâu rồi không nghe Ngày xưa, miền Nam respect lên LongLe ❤ Bạn trai cũ dạy em nếu gặp popo phải núp đi Bây giờ mỗi Khi Tao Lượn ở Khu Tao Sống lại nhớ tới Subby ❤   Dép: Hay là mình bỏ qua hết đi em Trách nhau làm chi nữa~ Nửa đời người thấm thoát qua mau Vụn vỡ với những niềm đau Anh luôn là kẻ điên, trên con đường tình duyên Em luôn là niềm khát khao, khát khao diệu êm Đời người khó đoán, còn lắm lo toan Mờ dần những phút giây em còn đây ngất ngay Đừng buồn em hỡi, mình sẽ rong chơi Tìm lại những giấc mơ đến giờ chưa phai màu (mờ) --- Đôi khi phải đi thật xa Qua bao đèo cao vực sâu Mới biết hạnh phúc có lúc bắt đầu từ điều rất tầm thường Em ơi đời như bụi bay Trăm năm vụt qua nào hay Có biết mới thấy ta sẽ yêu người từ điều rất tầm thường.!.! ",4bb3bc2a-0798-4cf1-982a-21879400392a,Anh Đã Từng Yêu
Quốc Thiên,,8ac66a6f-bfa4-41dd-bec1-8a47414e2f18,Chẳng Còn Tha Thiết Để Yêu
Nguyễn Hoàng Vân,,207cee59-20ac-451f-8430-ab0da1d8d0f5,Chúc Mừng Năm Mới (Happy New Year)
Đỗ Quang,,b571374f-11a6-4fd1-b6cc-0593918af4db,Hết Buồn
Huỳnh Gia Đạt,,3f4c1352-92ff-435d-bd67-0ae6659642ec,Đón Xuân
Vân Em,,baa0090e-1606-4556-a2c9-f468dc514e73,Như Hoa Mùa Xuân
Bùi Anh Tuấn,,07db92fa-0e89-4e8e-b77f-a0f3e863d0d3,Cảm Giác Lúc Ấy Sẽ Ra Sao (Live Cover)
V.A,,e1981cb7-8fb9-4cc3-af68-5390ea5fe8e4,Tỏa Sáng Đại Dương
V.A,,0fb841ef-ff1a-439c-a3d1-7d649d4b2bee,Ngày Xuân Long Phụng Sum Vầy
Thái Hoàng Trung,,fa0c4994-7437-4b7f-b5c5-b5c198aa14bc,Em Đẹp Nhất Đêm Nay
"Wanbi Tuấn Anh,Noo Phước Thịnh,V.A","Cảm Ơn - Wanbi Tuấn Anh, Noo Phước Thịnh, V.A  Ngày trôi qua ngày , nhận ra quay ta dường như biết bao niềm đổi thay Sao thời gian trôi thật mau, để giờ đây tôi thầm biết được rằng Thật hạnh phúc với những gì cuộc đời đã cho tôi.  Niềm vui nỗi buồn, sẽ mãi mãi trong tôi với kỉ niệm khó phai Dẫu ngày sau, đi về đâu nhưng lòng này tôi thầm muốn nói Tận đáy con tim chân thành vẫn mong được hát lên.  Cám ơn mẹ và ba, cám ơn một gia đình Đã cho niềm hạnh phúc, ấm êm không những lo toan Cám ơn người dạy dỗ, cám ơn người sinh thành Để bây giờ khôn lớn, bước qua bao đắng cay cuộc đời.  Niềm vui nỗi buồn, sẽ mãi mãi trong tôi với kỉ niệm khó phai Dẫu ngày sau, đi về đâu nhưng lòng này tôi thầm muốn nói Tận đáy con tim chân thành vẫn mong được hát lên.  Cám ơn bạn bè tôi, cám ơn người rất nhiều Vẫn luôn ở bên tôi dẫu khi tôi khóc tôi vui Cám ơn tình yêu ấy, cám ơn cuộc sống này Để tôi được hát mãi với con tim rất chân thành.  Cám ơn ngày hôm qua, tuổi thơ thật êm đềm Khắc ghi vào tim tôi tháng năm yêu dấu đã xa Cám ơn ngày hôm nay, khát khao và hi vọng Đã cho tôi niềm tin, tôi vẫn bước đến ngày mai.  Cám ơn và cám ơn Vẫn sống với bao tiếng cười... mọi người vẫn mãi bên tôi Cám ơn niềm hạnh phúc Cám ơn niềm đau này Những thăng trầm cuộc sống Đã cho tôi lớn hơn thêm.  Cám ơn niềm tín ấy với bao niềm chân thành Sẽ mãi mãi trong tôi những giấc mơ êm đềm. ",1ab84125-8c57-4a48-8a96-c597da192a43,Cảm Ơn
"Phi Nhung,Quỳnh Trang,Hồ Văn Cường",,d8dc9164-9e42-413a-be6e-584b924d4d13,Mùa Xuân Hạnh Phúc
Nam Cường,Bài hát: Sau Những Vỡ Tan - Nam Cường  Em khờ dại bấу lâu chẳng biết mình là ai Cố mong mỏi những tin уêu từ anh sẽ về lại Muốn giữ đó nụ cười từng làm cho em thổn thức Muốn giấu hết nỗi ưu tư vào trong tiếng mưa  Chỉ vì ai bước chân anh chẳng quaу về lại Bấу nhiêu lâu ta bên nhau nâng niu từng kí ức Mà chỉ hôm qua tất cả tình cảm đã phai nhòa Ngọt ngào mới đó có chắc sẽ bình уên  [Chorus:] Ѕợ rằng ngàу mai đến rồi biết đâu người ta khác rồi Nụ cười mới đó lại thành tiếng khóc mà thôi Rồi ai bên anh vỗ về những đêm lẻ loi não nề Chẳng lẽ anh gọi em trong tiếng thở dài  Ѕợ rằng sau bao khát vọng biết đâu rồi anh thất vọng Ngọt ngào che giấu những ngàу giông bão đằng sau Rồi ai bên anh nói cười lắng nghe câu chuуện của người Vì em đã bước đi sau những vỡ tan  [Lần 2:] Em ở đâу những уêu thương cũng vẫn ở đâу Nhưng em nghĩ mình chẳng còn điều gì để tiếc nuối Vì mấу năm qua em cũng đã trao anh tất cả Chỉ là anh quên điều đó phải không anh  [Chorus:] Ѕợ rằng ngàу mai đến rồi biết đâu người ta khác rồi Nụ cười mới đó lại thành tiếng khóc mà thôi Rồi ai bên anh vỗ về những đêm lẻ loi não nề Chẳng lẽ anh gọi em trong tiếng thở dài  Ѕợ rằng sau bao khát vọng biết đâu rồi anh thất vọng Ngọt ngào che giấu những ngàу giông bão đằng sau Rồi ai bên anh nói cười lắng nghe câu chuуện của người Vì em đã bước đi sau những vỡ tan  [Chorus:] Ѕợ rằng ngàу mai đến rồi biết đâu người ta khác rồi Nụ cười mới đó lại thành tiếng khóc mà thôi Rồi ai bên anh vỗ về những đêm lẻ loi não nề Chẳng lẽ anh gọi em trong tiếng thở dài  Ѕợ rằng sau bao khát vọng biết đâu rồi anh thất vọng Ngọt ngào che giấu những ngàу giông bão đằng sau Rồi ai bên anh nói cười lắng nghe câu chuуện của người Vì em đã bước đi sau những vỡ tan ,ac549730-ccca-46a2-bd49-d3e4dde15ac6,Sau Những Vỡ Tan
Nhật Linh,,7952afd6-9815-4bbd-b967-7771241d032c,Nếu Ta Ngược Lối Cover
Đức Dũng,,f3ceabae-413b-4a4d-87c6-07dbfdf5d120,Nép Vào Anh Và Nghe Anh Hát Cover
An Bom,,f35ac590-9a3b-4e66-9a79-4b415d0f7819,Là Tự Em Đa Tình (Vietnamese Cover)
"Thu Trang (DV Hài),Tiến Luật,V.A",,d7bfa2de-4fa3-41f3-b7b4-2c58175ba2f3,LK Mùa Xuân
Nguyễn Minh Hoàng,,3a157cc3-f5e2-440d-af4e-6170c3b6d669,Tình Đơn Phương Cover
Ngọc Anh,,1c3b02b7-0742-48ef-8d08-8d3fa73a1522,Tình Yêu Là Thế
"Hải H Trần,Cloudy,Phượng Linh",,a7822c54-c28d-43b4-b70c-abe0795f1462,Anh Đã Ăn Cơm Chưa
Văn Mai Hương,,f7a07102-f6b3-441a-baaa-6b2f03f54d63,Bước Về Phía Mặt Trời
V.A,,b32717b4-e52a-48e8-8b81-65d8756f07df,Ngày Xuân Long Phụng Sum Vầy
Nguyễn Tấn Đạt,,9ca412bf-3b4e-4ee7-9fd4-3416d7611047,Thương Em Là Điều Anh Không Thể Ngờ Cover
Vinh Quang,,0cf839b6-5700-4abb-811e-4f5f57519f81,Cỏ Úa Cover
Mr.D,,26ec3756-2ac4-4f0d-97e4-7c528b3641a1,Yêu
"Sato Than,Yoshii",,5f4808fa-d93f-4933-8675-f7e4e89294fb,Sẽ Quay Lại
V.A,,56110a72-7bbc-4169-aaab-4e74c59e7958,Thế Giới Năm 2000
Đào Ngọc Sang,,aacbf23b-7859-4165-8bf7-fadffaa1ac56,Hè Yêu Thương
"Cao Duy,Hoàng Kim",,4bc98879-2aa3-4ef8-b46b-de8fde47d2b3,Ngứa Cổ Hát Chơi
Quang Thắng,,9b13941d-704e-4fcd-ae33-6aec01fd38a6,Anh Cho Em Mùa Xuân
Bảo Hân,,3492a365-6bab-469c-8209-869b96da5ed4,Xuân Không Màu
Mr Hùng,,e0d6f157-9b42-43f6-9e05-f88805f4969e,Tết Xuân Cover
Anh Thy,,4a49bd44-f0d4-4cdb-b56b-b578bbaec628,Bay Cover
"Đào Ngọc Sang,Lâm Ánh Ngọc,Hữu Thọ",,73e99364-01cd-4378-a7ff-c4367db73897,Yêu Lắm Bóng Đá Việt Nam (Acoustic Version)
"Quỳnh Như,Tâm Như",,cf34d9d6-ce06-4a6b-bb44-61058c7050c4,Xuân Yêu Thương Cover
Neo,,14154e58-c925-4193-8f9b-bc1dde237078,Vẽ Ước Mơ
Đào Ngọc Sang,,a9ffa388-ff31-4c79-abde-20edbc04a4e6,Bờ Thương
Thành Phương,,8c886832-edf1-4d87-830f-a43f42699127,Chạm Khẽ Tim Anh Một Chút Thôi Cover
Mr Hùng,,a54071f6-9b9d-4d45-8063-31b2b69f7e05,Cuộc Đời Là Những Chuyến Đi Cover
V.A,,4c9b3eb1-8d4d-4264-b9b8-5d759e5dc0fb,Thanh Xuân Của Chúng Ta Cover
Hoàng Dũng,,73abdb96-c494-4253-9fce-b54075dd6a5c,Lời Hứa
Ngọc Ánh,,979750d2-9a65-431f-a88f-a3b9a48386cc,Bên Nhau Ngày Vui
